{
    "$schema": "http://json-schema.org/draft-07/schema#",
    "title": "Software Quality Indicator",
    "type": "object",
    "properties": {
        "@context": {
            "type": "string",
            "const": "https://w3id.org/everse/rsqi#"
        },
        "@id": {
            "type": "string",
            "format": "uri"
        },
        "@type": {
            "type": "string",
            "description": "The type of the quality indicator."
        },
        "name": {
            "type": "string",
            "description": "The name of the quality indicator."
        },
        "abbreviation": {
            "type": "string",
            "description": "Abbreviation or short form of the indicator name."
        },
        "alternateName": {
            "type": "string",
            "description": "Alternate name available for the indicator."
        },
        "description": {
            "type": "string",
            "description": "A brief description of the quality indicator."
        },
        "author": {
            "oneOf": [
                {
                    "type": "object",
                    "description": "The author of the quality indicator.",
                    "properties": {
                        "@type": {
                            "type": "string",
                            "format": "uri"

                        },
                        "name": {
                            "type": "string"
                        },
                        "email": {
                            "type": "string",
                            "format": "email"
                        },
                        "url": {
                            "type": "string",
                            "format": "uri"
                        }
                    }
                },
                {
                    "type": "array",
                    "description": "Multiple authors of the quality indicator.",
                    "items": {
                        "type": "object",
                        "properties": {
                            "@type": {
                                "type": "string",
                                "format": "uri"

                            },
                            "name": {
                                "type": "string"
                            },
                            "email": {
                                "type": "string",
                                "format": "email"
                            },
                            "url": {
                                "type": "string",
                                "format": "uri"
                            }
                        }
                    }
                }
            ]
        },
        "created": {
            "type": "string",
            "format": "date-time",
            "description": "The creation date of the quality indicator."
        },
        "version": {
            "type": "string",
            "description": "The version of the quality indicator."
        },
        "status": {
            "type": "string",
            "description": "The status of the quality indicator."
        },
        "keywords": {
            "type": "array",
            "items": {
                "type": "string"
            },
            "description": "Keywords associated with the quality indicator."
        },
        "identifier": {
            "type": "object",
            "description": "An identifier for the quality indicator.",
            "properties": {
                "@id": {
                    "type": "string",
                    "format": "uri"

                }
            }
        },
        "qualityDimension": {
            "oneOf": [
                {
                    "type": "object",
                    "description": "The quality dimension this indicator pertains to.",
                    "properties": {
                        "@id": {
                            "type": "string",
                            "format": "uri"

                        }
                    }
                },
                {
                    "type": "array",
                    "description": "Multiple quality dimensions this indicator pertains to.",
                    "items": {
                        "type": "object",
                        "properties": {
                            "@id": {
                                "type": "string",
                                "format": "uri"

                            }
                        }
                    }
                }
            ]
        },
        "source": {
            "oneOf": [
                {
                    "type": "object",
                    "description": "The source from which this indicator is derived.",
                    "properties": {
                        "@id": {
                            "type": "string",
                            "format": "uri"

                        },
                        "identifier": {
                            "type": "string",
                            "format": "uri"
                        },
                        "@type": {
                            "type": "string"
                        },
                        "url": {
                            "type": "string",
                            "format": "uri"
                        },
                        "name": {
                            "type": "string"
                        }
                    },
                    "required": [
                        "name"
                    ]
                },
                {
                    "type": "array",
                    "description": "Multiple sources from which this indicator is derived.",
                    "items": {
                        "type": "object",
                        "properties": {
                            "@id": {
                                "type": "string",
                                "format": "uri"

                            },
                            "identifier": {
                                "type": "string",
                                "format": "uri"
                            },
                            "@type": {
                                "type": "string"
                            },
                            "url": {
                                "type": "string",
                                "format": "uri"
                            },
                            "name": {
                                "type": "string"
                            }
                        },
                        "required": [
                            "name"
                        ]
                    }
                }
            ]
        },
        "contact": {
            "oneOf": [
                {
                    "type": "object",
                    "description": "Contact point for more information.",
                    "properties": {
                        "@type": {
                            "type": "string",
                            "format": "uri"
                        },
                        "name": {
                            "type": "string"
                        },
                        "email": {
                            "type": "string",
                            "format": "email"
                        }
                    }
                },
                {
                    "type": "array",
                    "description": "Multiple contact points for more information.",
                    "items": {
                        "type": "object",
                        "properties": {
                            "@type": {
                                "type": "string",
                                "format": "uri"
                            },
                            "name": {
                                "type": "string"
                            },
                            "email": {
                                "type": "string",
                                "format": "email"
                            }
                        }
                    }
                }
            ]
        },
        "contactPoint": {
            "oneOf": [
                {
                    "type": "object",
                    "description": "Contact point for more information.",
                    "properties": {
                        "@type": {
                            "type": "string",
                            "format": "uri"
                        },
                "name": {
                            "type": "string"
                        },
                        "email": {
                            "type": "string",
                            "format": "email"
                        }
                    }
                },
                {
                    "type": "array",
                    "description": "Multiple contact points for more information.",
                    "items": {
                        "type": "object",
                        "properties": {
                            "@type": {
                                "type": "string",
                                "format": "uri"
                            },
                            "name": {
                                "type": "string"
                            },
                            "email": {
                                "type": "string",
                                "format": "email"
                            }
                        }
                    }
                }
            ]
        },
        "sameAs": {
            "type": "string",
            "format": "uri",
            "description": "URL of a reference Web page that unambiguously indicates the item's identity. E.g. the URL of the item's Wikipedia page, Wikidata entry, or official website."
        }
    },
    "required": [
        "@context",
        "@type",
        "name",
        "abbreviation",
        "description",
        "contact",
        "version",
        "identifier",
        "qualityDimension"
    ],
    "additionalProperties": false
}