{
    "@context": "https://w3id.org/everse/rsqi#",
    "@id": "https://w3id.org/everse/i/indicators/persistent_and_unique_identifier",
    "@type": "SoftwareQualityIndicator",
    "name": "Software has persistent and unique identifier",
    "abbreviation": "persistent_and_unique_identifier",
    "alternateName": "FRSM-01",
    "description": "This indicator tries to determine if the software identifier is based on a suitable identifier scheme, and test it can be resolved. This is done by checking if the identifier uses an identifier scheme contained in a list of globally unique identifier schemes.",
    "keywords": [ "identifier", "unique", "fair", "persistent", "metadata"],
    "identifier": { "@id": "https://w3id.org/everse/i/indicators/persistent_and_unique_identifier" },
    "sameAs": "https://doi.org/10.25504/FAIRsharing.87c9a8", 
    "status": "Active",
    "version": "1.0.0",
    "contact": [
    {
        "@type": "schema:Person",
        "name": "Daniel Garijo"
    },
    {
        "@type": "schema:Person",
        "name": "Andres Montero"
    }
    ],
    "author" : {
        "@type" : "schema:Organization",
        "name" : "FAIR-IMPACT"
    },
    "source": {
        "url": "https://zenodo.org/records/10047401",
        "name": "D5.2 - Metrics for automated FAIR software assessment in a disciplinary context"
    },
    "qualityDimension": { "@id": "https://w3id.org/everse/i/dimensions/fairness" },
    "created": "23-05-2025"
}