{
    "@context": "https://w3id.org/everse/rsqi#",
    "@id": "https://w3id.org/everse/i/indicators/software_has_documentation",
    "@type": "SoftwareQualityIndicator",
    "name": "Software has documentation",
    "abbreviation": "software_has_documentation",
    "alternateName": "FRSM-05",
    "description": "This indicator aims to determine if a software project comes with many forms of documentation like readme or readthedocs.",
    "keywords": [ "documentation", "fair", "usage", "readme"],
    "identifier": { "@id": "https://w3id.org/everse/i/indicators/software_has_documentation" },
    "sameAs": "https://doi.org/10.25504/FAIRsharing.452bcd",
    "status": "Active",
    "version": "1.0.0",
    "author" : {
        "@type" : "schema:Organization",
        "name" : "OpenSSF",
        "url" : "https://openssf.org/"
    },
    "contact": [
    {
        "@type": "schema:Person",
        "name": "Daniel Garijo"
    },
    {
        "@type": "schema:Person",
        "name": "Andres Montero"
    }
    ],
    "source": {
        "url": "https://www.bestpractices.dev/en/criteria/0#0.documentation_basics",
        "name": "FLOSS Best Practices Criteria"
    },
    "qualityDimension": [
        { "@id": "https://w3id.org/everse/i/dimensions/fairness" },
        { "@id": "https://w3id.org/everse/i/dimensions/interaction_capability" }
    ],
    "created": "23-05-2025"
}