{
  "@context": "https://w3id.org/everse/rsqi#",
  "@id": "https://w3id.org/everse/i/indicators/software_test_coverage",
  "@type": "SoftwareQualityIndicator",
  "name": "Software has sufficient test coverage",
  "abbreviation": "software_test_coverage",
  "description": "Indicates that the test suite covers most (or ideally all) the code branches, input fields, and functionality.",
  "keywords": [
    "test coverage",
    "code coverage",
    "branch coverage",
    "coverage threshold",
    "test completeness"
  ],
  "identifier": {
    "@id": "https://w3id.org/everse/i/indicators/software_test_coverage"
  },
  "status": "Active",
  "version": "0.0.1",
  "author": {
    "@type": "schema:Organization",
    "name": "ELIXIR-Steers",
    "url": "https://elixir-europe.org/about-us/how-funded/eu-projects/steers"
  },
  "contact": [
    {
      "@type": "schema:Person",
      "name": "Daniel Garijo"
    },
    {
      "@type": "schema:Person",
      "name": "Andres Montero"
    }
  ],
  "source": {
    "url": "https://doi.org/10.5281/zenodo.17035105",
    "name": "ELIXIR Steers D2.1 Report on best-practices and indicators available and used by selected Communities"
  },
  "qualityDimension": [
    {
      "@id": "https://w3id.org/everse/i/dimensions/reliability"
    },
    {
      "@id": "https://w3id.org/everse/i/dimensions/functional_suitability"
    },
    {
      "@id": "https://w3id.org/everse/i/dimensions/sustainability"
    }
  ],
  "created": "03-12-2025"
}
