{
    "@context": "https://w3id.org/everse/rsqi#",
    "@id": "https://w3id.org/everse/i/indicators/project_is_active",
    "@type": "SoftwareQualityIndicator",
    "name": "Project repository is active",
    "abbreviation": "project_is_active",
    "description": "This indicator aims to determine if a project's repository is maintained by its corresponding maintainers (i.e. commiting within a reasonable time window or having a status of \"Active\").",
    "keywords": [ "active", "project", "repository", "maintainability"],
    "identifier": { "@id": "https://w3id.org/everse/i/indicators/project_is_active" },
    "status": "Active",
    "version": "1.0.0",
    "author" : {
        "@type" : "schema:Organization",
        "name" : "OpenSSF",
        "url" : "https://openssf.org/"
    },
    "contact": [
    {
        "@type": "schema:Person",
        "name": "Daniel Garijo"
    },
    {
        "@type": "schema:Person",
        "name": "Andres Montero"
    }
    ],
    "source": {
        "url": "https://github.com/ossf/scorecard/blob/cd152cb6742c5b8f2f3d2b5193b41d9c50905198/docs/checks.md#maintained",
        "name": "OpenSSF Scorecard: Maintained"
    },
    "qualityDimension": { "@id": "https://w3id.org/everse/i/dimensions/maintainability" },
    "created": "16-04-2026"
}