{
    "@context": "https://w3id.org/everse/rsqi#",
    "@id": "https://w3id.org/everse/i/indicators/software_has_license",
    "@type": "SoftwareQualityIndicator",
    "name": "Software has license",
    "abbreviation": "software_has_license",
    "description": "This check tries to determine if the project has published a license",
    "alternateName": "FRSM-15",
    "keywords": [ "license", "metadata", "fair" ],
    "identifier": { "@id": "https://w3id.org/everse/i/indicators/software_has_license" },
    "status": "Active",
    "version": "1.0.0",
    "author" : {
        "@type" : "schema:Organization",
        "name" : "OpenSSF",
        "url" : "https://openssf.org/"
    },
    "contact": [
    {
        "@type": "schema:Person",
        "name": "Daniel Garijo"
    },
    {
        "@type": "schema:Person",
        "name": "Andres Montero"
    }
    ],
    "source": [
        {
            "url": "https://github.com/ossf/scorecard/blob/cd152cb6742c5b8f2f3d2b5193b41d9c50905198/docs/checks.md#license",
            "name": "OpenSSF Scorecard: License"
        },
        {
            "url": "https://fair-impact.github.io/RSMD-guidelines/6.Reuse_legal/",
            "name": "Reuse, licensing and legal aspects. RSMD-6.2"
        }
    ],
    "qualityDimension": { "@id": "https://w3id.org/everse/i/dimensions/fairness" },
    "created": "23-05-2025"
}