{
    "@context": "https://w3id.org/everse/rsqi#",
    "@id": "https://w3id.org/everse/i/indicators/repository_workflows",
    "@type": "SoftwareQualityIndicator",
    "name": "Software has ci/cd workflows in its repository",
    "abbreviation": "repository_workflows",
    "description": "This indicator tries aims determine if a software project makes use of workflows to automatize processes like testing and deployment.",
    "keywords": [ "workflows", "github", "fair", "repository"],
    "identifier": { "@id": "https://w3id.org/everse/i/indicators/repository_workflows" },
    "status": "Active",
    "version": "1.0.0",
    "author" : {
        "@type" : "schema:Organization",
        "name" : "OpenSSF",
        "url" : "https://openssf.org/"
    },
    "contact": [
    {
        "@type": "schema:Person",
        "name": "Daniel Garijo"
    },
    {
        "@type": "schema:Person",
        "name": "Andres Montero"
    }
    ],
    "source": [
        {
            "url": "https://github.com/ossf/scorecard/blob/cd152cb6742c5b8f2f3d2b5193b41d9c50905198/docs/checks.md#ci-tests",
            "name": "OpenSSF Scorecard: CI-Tests"
        }
    ],
    "qualityDimension": { "@id": "https://w3id.org/everse/i/dimensions/maintainability"},
    "created": "23-05-2025"
}