{
    "@context": "https://w3id.org/everse/rsqi#",
    "@id": "https://w3id.org/everse/i/indicators/software_has_tests",
    "@type": "SoftwareQualityIndicator",
    "name": "Software provides tests",
    "abbreviation": "software_has_tests",
    "alternateName": "FRSM-14",
    "description": "Evaluates the extent to which the software has been tested, including unit tests, integration tests, and system tests, to ensure reliability and correctness.",
    "keywords": [ "test", "functionality", "fair"],
    "identifier": { "@id": "https://w3id.org/everse/i/indicators/software_has_tests" },
    "sameAs": "https://doi.org/10.25504/FAIRsharing.a2dd1a",
    "status": "Active",
    "version": "1.0.0",
    "contact": [
    {
        "@type": "schema:Person",
        "name": "Daniel Garijo"
    },
    {
        "@type": "schema:Person",
        "name": "Andres Montero"
    }
    ],
    "author" : {
        "@type" : "schema:Organization",
        "name" : "FAIR-IMPACT"
    },
    "source": {
        "url" : "https://zenodo.org/records/10047401",
        "name" : "D5.2 - Metrics for automated FAIR software assessment in a disciplinary context"
    },
    "qualityDimension": [
        { "@id": "https://w3id.org/everse/i/dimensions/fairness" },
        { "@id": "https://w3id.org/everse/i/dimensions/reliability" }
    ],
    "created": "23-05-2025"
}