{
    "@context": "https://w3id.org/everse/rsqi#",
    "@id": "https://w3id.org/everse/i/indicators/archived_in_scholarly_repository",
    "@type": "SoftwareQualityIndicator",
    "name": "Software is archived in a scholarly repository",
    "abbreviation": "archived_in_scholarly_repository",
    "description": "The source code repository is archived in a scholarly repository (e.g Zenodo, HAL) to ensure that software can be found and accessed in a scholarly context.",
    "source": {
        "@id": "https://fair-impact.github.io/RSMD-guidelines/8.rsmd_checklist/",
        "url": "https://fair-impact.github.io/RSMD-guidelines/8.rsmd_checklist/#accessibility-and-preservation",
        "name": "Accessibility and preservation. RSMD 2.2"
    },
    "keywords": ["repository", "fair", "scholar"],
    "identifier": { "@id": "https://w3id.org/everse/i/indicators/archived_in_scholarly_repository"},
    "contact": [
    {
        "@type": "schema:Person",
        "name": "Daniel Garijo"
    },
    {
        "@type": "schema:Person",
        "name": "Andres Montero"
    }
    ],
    "status": "Active",
    "version": "1.0.0",
    "author" : {
        "@type" : "schema:Organization",
        "name" : "FAIR-IMPACT"
    },
    "qualityDimension": { "@id": "https://w3id.org/everse/i/dimensions/fairness" },
    "created": "23-06-2025"
  }
