{
    "@context": "https://w3id.org/everse/rsqi#",
    "@id": "https://w3id.org/everse/i/indicators/has_no_binary_artifacts",
    "@type": "SoftwareQualityIndicator",
    "name": "Project repository has no binary artifacts",
    "abbreviation": "has_no_binary_artifacts",
    "description": "The repository does not contain binary artifacts. Binary artifacts are files generated by compilation or packaging tools that contain code that is no longer human-readable (i.e. .class, .jar, .war, .pyc, etc.).",
    "source": {
        "url": "https://github.com/ossf/scorecard/blob/c22063e786c11f9dd714d777a687ff7c4599b600/docs/checks.md#binary-artifacts",
        "name": "Binary-Artifacts"
    },
    "keywords": ["binary artifact", "repository"],
    "identifier": { "@id": "https://w3id.org/everse/i/indicators/has_no_binary_artifacts"},
    "status": "Active",
    "version": "1.0.0",
    "author": {
        "@type": "Organization",
        "name": "OpenSSF",
        "url": "https://openssf.org/"
    },
    "contact": [
        {
            "@type": "schema:Person",
            "name": "Daniel Garijo",
            "email": "daniel.garijo@upm.es"
        },
        {
            "@type": "schema:Person",
            "name": "Andres Montero",
            "email": "andres.montero.martin@upm.es"
        }
    ],
    "qualityDimension": { "@id": "https://w3id.org/everse/i/dimensions/security"},
    "created": "13-05-2026"
  }