{
    "@context": "https://w3id.org/everse/rsqi#",
    "@id": "https://w3id.org/everse/i/indicators/static_analysis_common_vulnerabilities",
    "@type": "SoftwareQualityIndicator",
    "name": "Has static analysis for common vulnerabilities",
    "abbreviation": "static_analysis_common_vulnerabilities",
    "description": "At least one static code analysis tool used includes rules or techniques to detect common vulnerabilities specific to the language or environment.",
    "source": {
        "@id": "https://www.bestpractices.dev/en/criteria/0",
        "url": "https://www.bestpractices.dev/en/criteria/0#0.static_analysis_common_vulnerabilities",
        "name": "FLOSS Best Practices Criteria (Passing Badge)"
    },
    "keywords": ["security", "vulnerabilities", "static analysis"],
    "identifier": { "@id": "https://w3id.org/everse/i/indicators/static_analysis_common_vulnerabilities"},
    "status": "Active",
    "version": "1.0.0",
    "author": {
        "@type": "Organization",
        "name": "OpenSSF",
        "url": "https://openssf.org/"
    },
    "contact": {
        "@type": "schema:Person",
        "name": "Thomas Vuillaume",
        "email": "thomas.vuillaume@lapp.in2p3.fr"
    },
    "qualityDimension": { "@id": "https://w3id.org/everse/i/dimensions/security"},
    "created": "03-04-2025"
  }