{
    "@context": "https://w3id.org/everse/rsqi#",
    "@id": "https://w3id.org/everse/i/indicators/fuzzing_use",
    "@type": "SoftwareQualityIndicator",
    "name": "Software uses fuzzing",
    "abbreviation": "fuzzing_use",
    "description": "This indicator checks that If the software produced by the project includes software written using a memory-unsafe language (e.g., C or C++), then at least one dynamic tool (e.g., a fuzzer or web application scanner) be routinely used in combination with a mechanism to detect memory safety problems such as buffer overwrites. ",
    "keywords": [ "fuzzing", "test", "code"],
    "identifier": { "@id": "https://w3id.org/everse/i/indicators/fuzzing_use" },
    "status": "Active",
    "version": "1.0.0",
    "author" : {
        "@type" : "schema:Organization",
        "name" : "OpenSSF",
        "url" : "https://openssf.org/"
    },
    "contact": [
    {
        "@type": "schema:Person",
        "name": "Daniel Garijo"
    },
    {
        "@type": "schema:Person",
        "name": "Andres Montero"
    }
    ],
    "source": {
        "url": "https://github.com/ossf/scorecard/blob/cd152cb6742c5b8f2f3d2b5193b41d9c50905198/docs/checks.md#fuzzing",
        "name": "OpenSSF Scorecard: Fuzzing"
    },
    "qualityDimension": { "@id": "https://w3id.org/everse/i/dimensions/safety" },
    "created": "23-06-2025"
}