{
  "@context": "https://w3id.org/everse/rsqi#",
  "@id": "https://w3id.org/everse/i/indicators/functional_correctness",
  "@type": "SoftwareQualityIndicator",
  "name": "Has a measure of functional correctness",
  "abbreviation": "functional_correctness",
  "description": "For analysis code specifically, is there a quantifiable measure of the functional correctness of the software output. This indicator focuses on computational/statistical correctness. For example, in an ML model software context, the indicator measures whether the repository reports metrics like Accuracy, F1-score, or ROC-AUC to prove the model performs as intended. However other performance metrics may also address the indicator. Evaluation metrics may be provided through documentation, tables or scripts available in the source code of the target tool.",
  "source": {
    "@id": "https://dome-ml.org/guidelines",
    "url": "https://dome-ml.org/guidelines#evaluation-section",
    "name": "DOME Recommendations for Supervised Machine Learning (Evaluation section)"
  },
  "keywords": [
    "correctness",
    "machine learning",
    "models"
  ],
  "identifier": {
    "@id": "https://w3id.org/everse/i/indicators/functional_correctness"
  },
  "status": "Active",
  "version": "1.0.0",
  "author": {
    "@type": "schema:Organization",
    "name": "University of Padova"
  },
  "contact": {
    "@type": "schema:Person",
    "name": "Gavin Farrell",
    "email": "gavinmichael.farrell@studenti.unipd.it"
  },
  "qualityDimension": {
    "@id": "https://w3id.org/everse/i/dimensions/functional_suitability"
  },
  "created": "03-12-2025"
}
