{
  "@context": "https://w3id.org/everse/rsqi#",
  "@id": "https://w3id.org/everse/i/indicators/maintainability_index_ok",
  "@type": "SoftwareQualityIndicator",
  "name": "Maintainability index follows community conventions",
  "abbreviation": "maintainability_index_ok",
  "identifier": { "@id": "https://w3id.org/everse/i/indicators/maintainability_index_ok" },
  "description": "The maintainability index (i.e., degree of effectiveness and efficiency with which a product or system can be modified by the intended maintainers) should follow conventions and standards established by the community responsible for maintaining the source code or system. The maintainability index depends on 3 main factors: cyclomatic complexiy, lines of code and halstead volume (amount of information that needs to be processed to understand the code). An example for calculating it could be MAX(0,(171 - 5.2 * ln(Halstead Volume) - 0.23 * (Cyclomatic Complexity) - 16.2 * ln(Lines of Code))*100 / 171).",
  "status": "Active",
  "keywords": [
    "maintainability", "code", "maintainability index"
  ],
  "version": "1.0.0",
  "contact": [
    {
        "@type": "schema:Person",
        "name": "Daniel Garijo"
    },
    {
        "@type": "schema:Person",
        "name": "Andres Montero"
    }
    ],
  "source": [
    {
      "identifier": "https://zenodo.org/records/10647227",
      "url": "https://zenodo.org/records/10647227",
      "name": "Task Force Sub Group 3 - Review of Software Quality Attributes and Characteristics"
    },
    {
      "url": "https://ieeexplore.ieee.org/stamp/stamp.jsp?tp=&arnumber=11216562&tag=1",
      "name": "Socially-Informed Jupyter Notebook Quality: A Role- and Lifecycle-Aware Metrics Framework"
    },
    {
      "url": "https://learn.microsoft.com/en-us/visualstudio/code-quality/code-metrics-maintainability-index-range-and-meaning?view=visualstudio",
      "name": "Code metrics - Maintainability index range and meaning"
    }
  ],
  "qualityDimension": [
    { "@id": "https://w3id.org/everse/i/dimensions/maintainability" },
    { "@id": "https://w3id.org/everse/i/dimensions/community"}
  ],
  "created": "14-04-2026"
}
